353,why can t more directors these days create horror movies like the shining there s an easy answer to that modern day directors are not stanley kubrick kubrick proved once and for all with this movie that he is truly one of the greatest directors and auteurs of all time so the plot is fairly simple a man named jack torrance played brilliantly by jack nicholson and his family move into a large secluded hotel to watch over it for the off season the kicker is that the previous caretaker of the hotel savagely murdered his wife and two girls what follows can most readily be summed by the title of the movie but you have to watch it to see what i mean this is the first movie in a very long time to strike me as scary it s some seriously messed up stuff but in a good way one of the things that adds to the scare factor is the amazing music music has been a major part of kubrick s movies 2001 a space oddysey and a clockwork orange just to name a couple and he definitely doesn t disappoint with this one the score completely sets the tone and this film would not be the same without it finally i must comment on nicholson s legendary performance jack is terrifyingly convincing as a crazy killer in fact just his stare steals a few scenes of this movie this is top notch acting that must be seen to believe there will never be a horror movie that quite matches this one r i p stanley 
746,i caught this on ifc last week and i thought it was typical of the indie short subject film heavy on style little on substance and originality does it comes as any surprise that a coming out film stars an unusually attractive and blond to boot boy with 70s shag hair and too cool for school clothes plus this film wallows in late 1970s chic which works for some sofia coppola s the virgin suicides comes to mind but not for this director another reviewer compared this to harmony korine s work and i agree yet i don t view this as a positive thing what has he done lately anyway bobbycrush is really just a waste of time and energy for all involved if you happen to see it late night on cable turn the channel and watch something else instead 
198,goodnight mister tom is so beautifully filmed and beautifully realised it isn t completely faithful to the book but does it have to be no not at all john thaw is mesmerising as tom oakley his transformation from gruff to caring was so well realised making it more believable than scrooge in christmas carol after inspector morse this is thaw s finest hour he was matched earnestly by a young nick robinson who gave a thoroughly convincing portrayal of an evacuee traumatised by the abusive relationship with his mother the script and music made it worth the buy and you also see thaw playing the organ amazing the most moving scene was willie finding out about zak s death and then tom telling him about his deceased family who died of scarlatina buy this you ll love it 10 10 bethany cox
595,david burton richard chamberlain quite good is a lawyer more adept at handling corporate taxation and suffers from unusual dreams which bother him seeing this aboriginal man shrouded in darkness who is called on to take a case concerning a group of aboriginals charged with the murder of one of their own named billy we see that he tries to steal stones with ritual painting on them and is killed when a leader of an aboriginal tribe named charlie nandjiwarra amagula uses a death bone to stop his heart meanwhile revolving around david bizarre weather patterns effect sydney such as rain beating down polluted dirt and rock sized hail during bright blue skies with no sights of clouds such as the one that hits a school in central australia not to mention a deformed rainbow which is split into groups as david pursues the case he finds that he is far closer to the weird events taking place than he could ever realize one aboriginal named chris david gulpilil appears to him in a dream holding a stone with blood and he finds that this man is one of those he is to represent at trial he finds that it s quite possible after some strange meetings with charlie and conversations with chris that he very well might be linked to a spirit named mulkurul and that his dreams are actual premonitions of possible horrors yet to come absorbing apocalyptic drama builds it s story methodically and is completely original and unpredictable with peter weir in charge the film is visually arresting as we see these very overwhelming images of possible doom towards civilization but the film s most compelling angle is certainly david s journey to find that monumental truth that plagues him as he questions charlie and chris countlessly at first to help his men get off from a crime they didn t commit and ultimately to find out what he has to do with anything catastrophic that is occurring or might occur later 
507,look if i were interested in a nancy drew book what i would do is pick up a book and read it i m not ever since i can remember i read people trashing movies because it wasn t like the book i m sorry in the digital age we can no longer watch movies on flip books however i m sure you can still find a few short silent films in book form when lord of the rings came out people complained when the third one won an oscar the book was better when i watched to kill a mockingbird the book was better now a bunch of people are upset yet again because nancy drew wasn t like the book i m not saying nancy drew is going to win any oscars if anything it ll be one of those nickelodeon blimps or kids choice awards i m saying give film a break it s film not paper as a movie i found nancy drew quite enjoyable featuring cameos from bruce willis and adam goldberg the hebrew hammer and supporting roles featuring tate donovan jimmy cooper on the o c and rachel leigh cook she s all that this is the first time i ve seen emma roberts in a movie and frankly i enjoy her work more than most of julia and of eric s her character stays consistent throughout the film and reacts well with conflict a lighthearted movie in the spirit of harriet the spy is nice now and again i give it ten stars because i thoroughly enjoyed the movie would love to see it again and will probably buy it upon dvd release 
878,i wait for each new episode each re run with anticipation the new look of sci fi created by stargate sg 1 is a wonder that i hope will never end to combine the past with the future is a new twist that is fascinating to me season 9 should be a thrill in itself i wish that richard dean anderson would show up more often in the new season as i love his dry wit as much as his temper tantrums in his character as jack o neill the other characters add their own uniqueness to the show that makes it a winner season after season you cancel this program in the next three years and you make a serious mistake also you need a bigger role for the asgard they are just too cool 
30,very interesting to find another reviewer who had the exact same reaction to this movie as i did it was a heck of a lot better when i was 10 or 11 years old seeing it more than 30 years later it s still okay but it only mildly held my interest what seemed hugely funny back then was only mildly amusing also things that were astonishing to me as a 10 year old came across as just silly for example in one scene trinity is walking along and fires his revolver behind him and kills two men without even looking in fact he doesn t even bother to look and see if they re dead because he knows he hit the mark um yeah right in addition a lot of the dialogue sounds quite wooden sorry but 35 years later it hasn t really aged that well although it s been a long time since i ve seen that one as well probably a better terrence hill film than this one would be my name is nobody 
468,mindless dribble about the second coming of christ in the form of a hippie and albino looking sandra locke you have no idea what s happening on the screen with the irritating theme song suzanne being played over and over throughout the movie until when the second coming of suzanne is over you already know it by hard no matter how hard you try to forget the whole thing this off the wall armature movie maker logan jared martin is out to make the movie of the century but is so rude and obnoxious that none in the banking world is willing to finance his project planning to go on his own logan then spots this couple at a seaside café and is fascinated with the young woman suzanne sandra locke who reminds him of someone he knew in another life jesus christ with logan s assistant and all around gofer clavius richard dreyfuss somehow getting a 740 000 00 loan from the bank to finance logan s masterpiece he starts to work on suzanne by flattering her about her talent as an actress in order to get her interested to be in his film this leads to suzanne not only leaving her boyfriend artist simon paul sand but later simon being so depressed and feeling all alone takes a gun to his mouth and blows his brains out the movie also has two somewhat unrelated sub plots in it that has to do with a young autistic girl dorothy kari avalos who s cured of her autism by suzanne after everyone else at the psychiatric hospital that she was committed to failed it s not really known what exactly suzanne was doing at the hospital but she seemed to be some kind of orderly or volunteer there was this supposed to show us in the audience that she like jesus could miraculously heal the sick there s also this newspaper columnist and big time businessman tycoon jackson sinclair gene barry who seems to be either going through a very difficult mid life crisis or has seen a biblical like vision that changed his life forever sinclair had been searching for the meaning of life as well as what it s all about all through the movie and wanted to know why there s all this suffering in the world like this movie that he s in and seemed to have found the answer when he first laid his eyes on suzanne sinclair also got some sense knocked into his head when his private chauffeur david mark rasmusser who s gotten sick and tired of his weird and crazy hallucinations almost running him off a cliff in a kamikaze like drive along the pacific coast the movie the second coming of suzanne goes on with a number of unrelated sequences probably to fill or pad in some time by it s director and film editor and then goes to it s final scene in a christ like crucification on a hill as logan has all the cameras rolling it turns out that the crazed logan got so carried away with his masterpiece as he tried to replicate on the helpless and tied up suzanne the actual crucification of jesus christ some 2 000 years ago hard to sit through and almost impossible to follow the second coming of suzanne puts you through the same kind torture that suzanne is put through by logan and the makers of the film the movie tries to be arty but that s just an excuse to cover up it s brainless and non existent storyline and even worse the terrible and amateurish acting by everyone in it 
59,this is a beautiful film the true tale of bond between father and son this is by far tom hanks at his finest tom hanks is really out of the box in this movie he usually has the nice guy roles yet in this film he comes off in this film as a bit gritty but still emerges smelling like a rose even until the very last scene the assassination of his character the cast of this movie was well put together i also love the part when there is total silence when tom hanks character shoots and kills all of the men in mr rooney s group there is something chilling and yet profound about no sound in that scene just simply emotion i love the look on john rooney paul newman s character s face when he realizes even before seeing him that it is tom hanks s character getting revenge and he knows his fate has come the first time i saw this movie i was blown away and knew i had to go out and get the video and i since have adding it to my collection of my all time favorite movies tom hanks is my favorite actor so this film has a special place in me 
506,i myself feel this film is a rare treasure not only is it the beginning of shirley temple s career but a rare look on how our society has changed you have to understand certain things we today would view as sexual back then would be considered innocent for example the parents of the children in the film as well as the many parents who took their children to see this movie saw this as just children mimicking adults most people didn t think of anyone viewing children sexually attractive other than teenage boys lusting over teenage girls to them it wasn t sexual mind you this was before we had internet tv etc most sex crimes weren t openly brought up occasionally there would be a whisper about the kid with the funny uncle but that was often all that came of it yes very sad but it is kinda sad today for even i too can see this film as anything other than what it was intended innocent and funny when i saw shirley dance like that and the boys eye balling her yes i felt disturbed i have to remind myself the time this took place those children didn t know what sex was the parents knew that both those of the children in the movie and those watching it the thought may not have even entered their minds in the eyes of the average adult back then this was no more sexual then if shirley was playing house even today kids will enter beauty contest many dressed up extremely maturely for a three yr old however the child is merely pretending i don t blame the child for wanting to act like an adult or the old movies that display this in all honesty our media has made a lot of things seem back then seem sick and wrong this sometimes can be for the best but i truly believe this movie isn t one of them it gives a rare look of an innocent mentality that we have long lost 
732,ok so maybe it s because i m from the north east of scotland and i talk just like the guys in this film but i found this great fun cheap fun to be sure but plenty of effort has gone into making the film look great and the actors certainly give it all i was actually quite effected when they died in particulare when the captain finally fell the script well it s a game of 2 halfs the opening half of the film is well written and sharp the last half hour is not so great with many questions left unanswered this will doubtless annoy others as it annoyed me but nevertheless good fun and a very smart first feature from sturton 
56,when the italians and miles o keeffe work together nothing can go wrong as ever miles is great as the almost as great ator the most lovable barbarian of all times totally lives up to the first movie 
435,one should not be too critical about the director s second feature i really like the camera work of madiba as mr shawn pointed out he had a unique way of looking at things however howcome a 14 year old boy shoot such beautiful images remember he has not got any education of any sort i don t think english is the common tongue in cape town ghettos worse still madiba looks even smaller than his supposed age of 14 any way if you overcome above mentioned peculiarities you can watch the film and still enjoy it because of nice camera work 
909,i can t believe that the city of muncie is so hard up for attention that they would embarrass themselves by allowing this show to be done there this show is like a slap in the face to real hard working law enforcement officers i have never before in my life seen anything so stupid in my life if they had billed it as a comedy that would be one thing but to say it is reality is nothing short of a lie i only saw it once and was appalled at what i saw i wanted to see the little guy get into a foot chase with a bad guy what a joke that would have been nothing on the show was even close to the real world the city of muncie the police chief and all the officers should be hanging their heads in shame and should never want o admit they come from that city no wonder it didn t stay around on tv
937,when i borrowed this movie from a friend thankfully i did not buy it on the package which truly looked bad and ugly was printed the ultimate vampire horror after watching it i thought that the marketing campaign was probably more expensive than the film itself the story begins when a teenager surprise is chased by some vampire zombie creatures lighting sound and everything reminded me of my first attempt to make a holiday video on a ten year old vhs system if not worse i gave the movie a 2 out of 10 and only because the promo t shirts looked kind of cool i don t want to dis film students or splatter movies generally but i ve seen braindead and i ve seen a 20 dollar budget movie from students that was ten times better than this crap 
217,in the wasteland that hollywood productions have become of late this movie in and of itself is truly manna from heaven in what could best be described as a cute movie approximately 350 years of movie acting experience allright give or take 100 years joyously lights up the screen to tell a tale of deceit remorse and redemption about a catholic family in buffalo ny truly well positioned to take its place in the feel good movie genre this quiet little independent film by the burton sisters five sisters productions company will leave a smile on your face and joy in your heart all while renewing your faith in mankind from the spectacular opening scene shots of buffalo ny to the final credits the film manages to tell a tale that could have been told of any family anywhere yet somehow this particular gathering of family and family by association in a small non descript house in buffalo more than fits the bill if you ve never been to buffalo you ll leave the theater with thoughts of shuffling off for a visit shots of the city landmarks and surroundings help to bring a quaint down to earth tone to the film which suits it just fine the quiet beauty of the queen city of the great lakes compliments rather than detracts from the tale that is being told if only more movies would take advantage of the natural beauty of this country s second cities instead of running off to a soundstage somewhere the end results would be so much more believable great performances by shirley jones frank gorshin wendy malick jill eickenberry and the rest of the ensemble cast prove again that true talent outlasts hollywood s flavor of the week any time go see this movie you ve wandered in hollywood s desert for too long 
410,i had read up on the film and thought it would be cute a feel good saturday night movie i wasn t expecting anything great figured it would be mostly fluff but hopefully not a totally bad experience i have to admit i was pleasantly surprised the dialogue was pitch perfect most of the actors were exceptionally good and it flowed nicely ash christian was perfect his ability to turn an awkward moment into something touching was nice to see he could have turned this character into something we ve all seen before but instead strayed away from stereotypes and focused on the wittiness of the character it was wonderful to see jonathan caouette again i didn t know what he would do after tarnation ashley fink is gem a great young character actress that hopefully will get more work there are moments in the film that could have used some work but all in all not a bad time at the cinema my friend described it as a gay angus napoleon dynamite but it s something more than that it s a character study into what it s like to grow up gay in a small town the pain is there but the humor behind that pain that only age can make clearer is magnified i look forward to seeing more of ash christian ashley fink and jonathan caouette soon 
982,although i had previously watched this one some time ago on italian tv i found it to be a surprisingly tolerable potboiler this time round buoyed by an international cast of familiar faces including a bemused joseph cotten as the baron and contrary to many another film of the euro cult sub genre an incident packed plot in place of lethargic pacing the creature itself looks a bit dodgy and cotten is a bit too old to be taken seriously as an eager scientist still dabbling in creating life forms out of corpses one would have thought that he would have made himself an army of them by now and not struggling at perfecting his technique still but ms neri does look good in and out of costume and reliable herbert fux probably comes off best as a lecherous grave robber blackmailer 
852,spoilers following i picked up the book evil angels when it first came out knowing nothing of the case just to give the press and the austrialian people a break here i was quite far into it before i began to question the chamberlain s guilt the author obviously intended the reader to understand why the public jumped to the conclusions they did john bryson told the story just as it was presented to the jurors and picked up by the press of the arterial spray the actelone plates dr james cameron s certainty that the collar was cut with scissors that a baby could not be taken whole from her clothes with the buttons still done up bloody hand print etc all quite convincingly after all these were experts in their fields who were testifying with no apparent reason to lie and the fact that the evidence was completely wrong wasn t apparent to me at all it was also highly technical evidence difficult for a layman to understand to this point beyond some hearsay testimony in the trials hardly anyone had ever heard of a dingo attacking a human people didn t believe it was possible the public was suspicious of the seventh day adventists whose origins made them appear to be a cult and all sorts of wild beliefs about them contributed to the appearance of guilt were it not for dedicated selfless lawyers who worked relentlessly to investigate and counter the trial testimony finding azaria s clothes later would not have been enough to get lindy out of jail the book shook me for that reason and i ve been reluctant to come to a conclusion about anyone s guilt ever since excepting oj of course i was thrilled that a movie was going to be made about the case and don t think it could have been done better i ve always liked sam who i could identify with completely and meryl was perfect as always beautiful photography haunting music i think it s not only a very good but a very important movie too bad it didn t receive more publicity at the time it was released 
14,gregory peck s brilliant portrayal of douglas macarthur from the battle of corregidor in the philippines at the start of the pacific war largely through to his removal as un commander during the korean war offers reason to believe all three of the above possibilities certainly the most controversial american general of the second world war and possibly ever macarthur is presented here as a man of massive contradictions he claims that soldiers above all yearn for peace yet he obviously glories in war he consistently denies any political ambitions yet almost everything he does is deliberately used to boost himself as a presidential candidate he obviously believes that soldiers under his command have to follow his orders to the letter yet he himself deliberately defies orders from the president of the united states he shows great respect for other cultures particularly in the philippines and japan and yet is completely out of touch with his own country all these things are held in balance throughout this movie and in the end the viewer is left to draw his or her own conclusions about the man although one is left with no doubt that macarthur sincerely and passionately loved his country and especially the army he devoted his life to peck s performance was as i said brilliant to the point actually of overshadowing virtually everyone else in the film which is perhaps appropriate given who he was portraying with the possible exception of ed flanders i though he offered a compelling look at harry truman and his attitude to macarthur sarcastic repeatedly referring to macarthur as his majesty angry frustrated and finally completely fed up with this general who simply won t respect his authority as president marj dusay was also intriguing as macarhur s wife jean devoted to her husband whom she herself referred to as general although their relationship seems to have been a happy enough one i very much enjoyed this movie although perhaps would have liked to have learned a little more about macarthur s early life i have always chuckled at macarthur s reaction to eisenhower being elected president he ll make a fine president he was the best damn clerk i ever had which seems to sum up what macarthur thought the role of the president should be especially to his military commanders during wartime well worth watching 8 10
44,love trap is a must see independent film when i sat down to watch the movie i came in with low expectations but left with a blessing the story is poetic substantive and creative the writer pulls you in further and further which each scene allowing you to relate to the realistic characters that every one can identify with the movie allowed me to reflect on my life and what i consider love to be the movie displayed what love really is action not emotion i was also impressed with the quality of the cinematography and the soundtrack of the movie the entire presentation surpassed my expectations i give the movie two big thumbs up and recommend it to everyone of all ages and all backgrounds 
