930,what a wasted opportunity to actually make an interesting film about a complicated subject there is very little exploration about what it really feels like to be a straight or gay man working in a gay sexual environment the dancers keep talking about their art as if it has no erotic component they may not all be prostitutes for hire but they are indeed sex workers playing out fantasies and selling private sessions where more than dancing is offered from the film one would get the impression that they mainly appeal to the women who go to the gay clubs and then end up hiring the dancers for private sessions even the shots in the club only show women in front of the stage and the dancers only playing to the women in the audience this just isn t the reality of these clubs it would be pretty hard to make a living doing private dances for straight women and couples so what do they really feel about their gay admirers and clients we learn very little instead we get filler a gay activist who adds nothing to the study of straight dancers a manager who tells us about the costumes for the drag acts but offers no insight into the dancers lives and attitudes the pictures of mexico city are generic the phallic montage showing sausages roasting is ridiculous this is a totally simplistic film which should be of interest only to those who want to see a few pictures of pretty boys dancing the rest of the movie is an insult to gay men 
601,return to cabin by the lake is perhaps one of the few sequels that can live up to the original it had black humor good suspense nice looking girls and of course a psycho killer what are we missing i think nothing except we are left with a small amount of gore and nudity because it was made for television besides being one of the best sequels it is one of the best thrillers to watch as a family recommended for everyone 
74,i really liked the movie the emporer s new groove but watching this was like coming home and seeing your wife having relations with a llama seriously this movie was bad it s like club dread after super troopers i am supposed to write 10 lines but i don t even know what else to say i laughed a couple of times but only because i was drinking a movie like that should at least be funny when your drunk it was not maybe llamas are just funny and regular cartoon people aren t either way just stick with the emporer s new groove if you want a funny cartoon llama themed movie line 10 is this line right here 
381,this is one of those cheaply made tv movies were the characters seem to lose all sense the premise of the story the kidnapping of a son by the boy s father is very good but the story just seems to beggar belief whenever the mother is advised not to do anything you know fine well she is going to do it it is a bit far fetched and not worthy of a viewing 
718,there are films that are not released in theaters but on video this one should be allowed to age and disintegrate the way old nitrate film stock does no story inept violence over acted badly written and the sorry thing is that the star was not the only bad part in the film and i did like and enjoyed some of siegel s other movies 
18,master kieslowsky came with an idea in 1993 the idea was to portrait how human relationship are in the world today passing from blue a crafted visual masterpiece about a woman s life from white a visual comedy movie about marriage and finally arriving to red a masterpiece dealing with human interaction while i m not going to spoil the move i can easily say red is the best movie from the 90 s decade because it has one of the strongest messages in a script i have ever ever seen the movie begins a little slow but finds it s rhythm early enough to keep you hooked through the whole movie the performances are perfect sublime since the characters are completely realistic and they re not clichéd in any way and one could expect no less from the actors and one doesn t get disappointed seriously i believe jean louis tringtignat deserved an oscar nod at least the music from zbiegnew preisner is amazing it s one of the best musical scores ever piotr sobocinsk cinematography is also outstanding he got an oscar nod for it and deserved to win overall the movie is a perfect 10 and will be loved by people that love foreign cinema and people who don t don t miss it how did the awful pulp fiction beat ed this masterpiece at cannes is beyond my comprehension
463,pure schlock from beginning to end the average 12 year old might find that it has an interesting take on discrimination otherwise it s a pure camp fest endurance test like one of those so so episodes of star trek the next generation that thinks it has something important to say you ll see every plot twist a mile off in this by the numbers romp however it s worth seeing for its portrayal of drag king prostitutes a brothel where young women pay old men to have sex with them how s that for role reversal and lesbian soap operas the ghost of valerie solanis lives 
816,not many people remember the carey treatment and i can t say i blame them blake edwards did this during his lean years i e between pink panther movies and for a story of a doctor turned detective coburn working to solve a murder in his hospital it s actually pretty forgettable coburn is dependable as always and o neill is beautiful as always but there just seems to be something missing from the proceedings the story twists and turns aren t very involving and even the climax which is supposed to be nerve wracking is gut wrenching instead a missed opportunity altogether and an unfortunate one at that since it was based on a michael crichton book oh well at least crichton didn t write a sequel to it one star carey on coburn 
418,first of all season 1 is intolerably bad the prison is ridiculously unrealistic the characters are so two dimensional they re nearly transparent and the direction is terrible it runs like a bad video of a junior high school play characters wandering past the camera and uttering highly timed and rehearsed lines passing off as random prison talk soon the show gets better but not by much the return from the commercial break is always accompanied by some ridiculous monologue by wheelchair bound augustus hill who is played impressively by harold perrineau the only time his character is consistently bad is during the bad performance art monologues most of which take place in an inexplicable rotating glass cube and generally have nothing to do with what s taking place in the show unfortunately the bad ideas in oz could fill an encyclopedia of several volumes consider the whole situation first of all prisoners are able to hang out in plain sight getting drunk doing drugs and they not only have cd players cds they might as well pass out steak knives but all incoming mail is thoroughly examined by prisoners christ the place is like a men s club with guards guards that don t do much near the end of season two an older prisoner s grandson is diagnosed with leukemia and all of the prisoners pitch in thick wads of 20 and 50 bills to help send him to disneyworld to fulfill his dying wish these have to be the richest prisoners in the world every single prisoner in oz all of a sudden became caring loving guys except kenny wangler an irritating character but one of the only ones who is consistently convincing even adibisi wanted to be nice but that s okay because there is no order or sense in the show so even this is not much of a distraction later shockingly there is a boxing scene in which one inmate is wearing an i love cops t shirt in prison can you imagine i have a cousin who was in prison a few years ago i sent him an old picture of us with some friends in high school and in the picture one of my friends was holding an i love cops bumper sticker and one of the woods guys who have been in prison for years and years saw the picture but just grabbed it and ripped it to shreds my cousin got lucky kenny wangler also constantly berates the guards and even more senior officers for not calling him bricks one of them even tried to bribe him to go to an english class you may lose track of who is in charge the prisoners or the guards more than one investigator for example goes into the prison undercover and gets killed trying to stop the drug trade personally i would just stop letting prisoners inspect incoming mail rather than risk the lives of investigators let s see what else shillinger s son od s in solitary and no one thinks to ask the guard how he got the drugs he just got them i guess and make sure to pay attention otherwise you ll miss the reason why the prisoners have enough money to be able to afford ascellular dermal grafts when they get bad gums i didn t know guests in maximum security prisons were afforded such luxurious treatment options how about this when robson asks about dr faraj s schedule so he can ask what race of gums he was given faraj is so terrified that he goes to the warden and quits his job on the spot do doctors and dentists not have the right to request not to see certain prisoners after poet and o reilly make the announcement to the entire prison robson asks to see dr faraj and is escorted to his office brought in without knocking and the guard promptly leaves without a word they might as well give him a gun i shouldn t go on about stupid ideas in this show but it s like a flood i can t stop it who thought of the chinese refugees who can t speak chinese and who disappear en masse from sight unless they re needed who thought of the goofy religious wars and all the reverend prisoners who though of robson s gum transplant what s the deal with busmalis and agamemnon agamemnon because he clearly doesn t belong in prison and busmalis because of the whole thing with his grandson macbeth because it was nothing but a ridiculous means to an end as it were but what are the worst ideas things that go nowhere which are constant an irish man comes to the prison and builds a bomb he threatens to blow up the entire prison the bomb turns out to be a dud and the episode ends with him being led away by the bomb squad after the entire prison is evacuated nothing is ever heard from him or about the whole situation again it s like it never happened in one episode prisoners are given dogs to train what the hell if that wasn t bad enough during one training session a guard fires his gun inside the prison walls as a training exercise no one seems to mind i also like how anytime some kind of altercation breaks out the culprits are pulled aside they don t say anything and the guards or warden or sister pete or whoever always says i hope you don t think i m gonna let this go and then they walk away and let it go the audience won t remember maybe i m spoiled by prison break but oz is just a goofy prison drama that might be better as a play a short one at least a low budget movie there is just not enough here to sustain a multi season tv show then again i watched six seasons of it on dvd sometimes i don t understand myself 
37,dressed to kill starts off with kate miller angie dickinson having a sexually explicit nightmare later on that day she visits her psychiatrist dr robert elliott michael caine for a session in which she admits to be sexually frustrated unfulfilled in her current marriage kate then visits a museum picks up a stranger they go back to his apartment for casual sex when done kate is set to leave but is attacked killed in the buildings elevator by a razor blade wielding blonde woman prostitute liz blake nancy allen discovers the gruesome scene sees the killer but manages to escape detective marino dennis franz says he suspects liz as being the killer as there are no other witnesses so liz teams up with kate s son peter keith gordon to track down the real killer clear liz s name see that justice is done written directed by brian de palma i thought dressed to kill was a good solid psychological murder mystery the script is measured slow at times but it likes to focus on the character s so you really know them the entire first twenty minutes is just developing kate as a character before she is suddenly killed off then the film switches it s attentions to liz no one else gets a look in this way dressed to kill is quite absorbing engaging unfortunately the character s themselves aren t exactly likable i found some of the dialogue quite funny at times especially the dirty talk that liz spouts occasionally the killers motives are somewhat plausible but i guess you d have to be pretty messed up to do anything suggested in dressed to kill it s a good film but it didn t excite me that much i didn t really find any character to root for or like the film tacks on a needless unnecessary twist ending that i didn t really see the point of director de palma directs with style visual flair from the art museum sequence to a car chase as a whole it s impeccably filmed throughout i d imagine that every shot in dressed to kill had a great deal of thought put into it i felt the film was a bit flat uninspired at times though nothing about it really excited me that much there is a fair bit of nudity some sex rape along with a few bits of gore violence kate s murder by razor blade in the elevator being the highlight if that s the right word however it s by no means as shocking or controversial when viewed today as many would have you believe with a supposed budget of about 6 500 000 dressed to kill has that glossy high production value feel of a hollywood film the new york locations are nice the cinematography is good as a whole it s extremely well made i thought the music was inappropriate was far to loud intrusive the acting is ok but despite his top billing i didn t think caine had that much screen time allen was married to director de palma at the time dressed to kill was made interestingly out of the four films she appeared in made by de palma in two of them this blow out 1981 he cast her as a prostitute a body double was used for dickinson as she pleasures herself in a shower at the start dressed to kill is a good thriller that is well worth watching but i didn t think it quite lived up to it s lofty reputation good but not brilliant 
954,this is one of those movies that appears on cable at like two in the afternoon to entertain bored housewives while they iron the acting is second rate poor mathew modine seems to sleepwalk through the whole film and god help gina gershon her accent is too over the top it sounds nothing like an true english woman it sounds forced and phony much like her acting she should stick to what she does best lesbian showgirl con artist who plays in a rock roll band and has a drug problem the other characters are no better they are two dimensional empty vapid and silly how are we to supposed to care about these people at one point christy scott cashman get s lost in central park really it s not that hard to navigate central park just follow any path out not only did i not care about any of the characters i downright hated them the only reason i even stayed with this train wreck of a film was fisher stevens even his brilliant humor couldn t save this dying fish each scene is typical romantic comedy fare and nothing is left to surprise us the script was awful as was the acting if you catch this fish throw it back 
609,this documentary is not only one of the best documentaries i ve seen but also one of the most moving and quietly beautiful movies i ve seen period it follows the lives of two sudanese young men peter and santino as they try to make their way into the american culture peter and santino are friends at first but they gradually drift more and more apart as peter goes to kansas city and santino stays in houston a land called houston santino s beauty is in his eyes he takes people onto his back he supports an apartment full of other sudanese paying the rent doing everything for other people he is a quiet sufferer peter looks out for himself getting a high school education while playing basketball and making christian friends it seems that director megan mylan did not know what she was getting herself into with the beauty of this tale peter and santino are amazing characters that move you but the real strength in this movie lies in its commentary on american society it is not judging it shows the strengths and weaknesses of our world and how difficult it can be to outside people i suggest you find this film and look at america through the lives of these two fascinating and beautiful people my grade 10 10
997,ed wood is eclipsed and becomes orson welles this film is fantastic vampire witches who fight in terribly choreographed scenes and dialog that could have breaking ribs with laughter plan 9 from outerspace dons t stand a chance against this described by the writer and psychic stephen armourae on the vampire forum as a masterpiece he s from england and thoroughly sarcastic it has stephanie beaton and the producers know whats going to save them from bankcrupcy by repeatedly using her though she leaves me cold as she looks more like the undead than all the devil raisers and eileen daly is just a lower rate elvira the whole thing is badly done watch it for the script though
915,to be honest this film is another in a series of huge disappointments most of these so called masters of horror films are only horrifying in terms of their sub par effects and laughable story lines aside from ron perlman everyone else in this film cannot act to save their life the gunshots sounded like someone was playing bop it under the boom mike or something and looked completely unrealistic overall this film is about as scary as home alone the only good masters are cigarette burns jennifer and maybe pelts i don t know how these directors can sleep at night knowing that they have ruined the very genre that some of them used to actually understand 
271,you can survive surviving christmas i thought the television version was a bit edited way down i like ben afleck he plays drew johnson a family less adult who is willing to pay complete strangers the valcos starring james gandolfini and catherine o hara as the parents and christina applegate as lisa valco the daughter drew is lonely around the holidays because he doesn t have a family of his own so he rents out a family in the chicago suburbs for a quarter million dollars bill macy who i best remember for playing maude s husband arthur is hired to play duda the grandfather when the whole situation comes crashing down the truth can be painful the valcos household is crumbling apart from the drew situation drew s rich girlfriend and her parents make a surprising visit you can t buy what you wish for the acting and writing is mediocre but the first rate cast pulls it through to the final scene 
532,walter matthau and jack lemmon both of whom are sadly missed proved once again that they were a team dedicated to their craft of bringing hilarious moments to the screen this film is just another example of this this time out they play two brothers in law who land on a ship as dance instructors on board of course their boss is a perfectionist and miserable person named gil godwin who just enjoys harassing these boys it s hilarious how lemmon gives a quick lesson in dancing to matthau and how the latter dances a riotous rumba with the boat s owner rue mclanahan too bad that fellow dance instructors hal linden and donald o connor are given so little to do but their parts call for that matthau falls for dyan cannon on board with her fellow gold digging mother the usual outrageous elaine stritch unknown to them matthau has no money either the widower lemmon falls for gloria de haven looking lovelier than ever the film belongs to matthau and lemmon and will serve as a further tribute to their illustrious careers 
884,i chuckled a few times during this movie i laughed out loud during the notarizing of the margarine company handover pun intended there are three segments in this movie the first one is supposed to be a spoof of woman grows up and launches career movies the tampax box was the funniest thing in this segment most of the cast members aren t listed here on imdb they are the lucky ones few other people will be able to connect this thing to the ruin of their acting careers the second segment is a spoof of sharkish woman sleeps her way to the top and seizes control of huge industry movies robert culp has several funny moments all physical humor including the aforementioned handover after his character dies the segment sinks lower and lower as dominique corsaire rises higher and higher by the time she becomes first lady i wanted to rip the cable out of the tv and watch snow i switched to pakistani music videos instead i don t understand urdu or whatever language the videos were in it was still better than listening to the dialogue in this painfully dull story then came municipalians with the big stars half of them on screen for less than a minute elisha cook jr christopher lloyd rhea perlman henny youngman julie kavner richard widmark and robby benson it s supposed to be a spoof of young cop teams with hardened substance abusing older cop who needs retirement badly movies the horizontal flash bar on the police car is very impressive it was interesting seeing old rtd buses and a shell gas station sign and an american savings sign none of them are around anymore nagurski s never stop anywhere you might have to get out the car made me smile momentarily then they discuss how boring the young cop is a lot back and forth about how boring he is that was as boring as this description of how boring it is nagurski s law number four never go into a music store that s been cut into with an acetylene torch made me think that the music store is a real business at the actual location the dispatcher gave thinking about that was more interesting than the set up for the gag which followed young falcone benson gets shot a lot he becomes a hardened cop like nagurski the segment keeps going on and on and on it won t stop it rolls relentlessly onward no matter how many times you wish he d just die already so this thing will end it doesn t it goes on and on and on then a buffy the vampire slayer episode which i ve seen four times already comes on thank god this abysmal movie ended while i went to get the mail 
242,paul rudnick jeffrey addams family values wrote this frothy tale of a mild mannered school teacher kevin kline who is outted on the academy awards by a former student turned actor matt dillon the rest of the film deals with the absurdities revolving around this setup the effect on the town his fiancee joan cusack himself and climaxes with an everybody loves everybody finale if you re an angry gay rights activist or a naive youth looking for an accurate portrayal of a man s struggle to come out or a true depiction of gay life then save yourself the trouble and rent something else maybe beautiful thing or read a book giovanni s room if you are able to understand that this film was inspired by the piousness of tom hanks s speech on the academy awards when he won for philadelphia and pokes fun at hollywood culture and small town ignorance and you have a fondness for 30 s screwball comedy bringing up baby holiday the palm beach story then enjoy far from being a biting satire the film tries for the exuberance of a preston sturges farce and comes damn close no it s not deep or powerful neither were romy michelle 9 to 5 or young frankenstein and it doesn t pretend to be it keeps it s tongue firmly in cheek it gets too preachy and maudlin for its own good toward the end and sure some of the jokes are a bit stale there s also a locker room scene that could have been cut but after sitting through countless comedies that misfire it s like a breath of fresh air kevin kline and tom selleck are wonderfully game while debbie reynolds and wilford brimley add fine support the excellent joan cusack s award winning performance is stellar and the great bob newhart is well bob newhart the fact that many have been offended by in out is as absurd as the mentality of the townsfolk it pokes fun at personally i was more offended by philadelphia i ll take harmless fluff over sanctimoniousness anytime 
380,i bought this rental return for 1 99 at hollywood and overpaid i didn t expect much but thought it would be something to fall asleep by at least i quickly noted the very weak storyline the gross overacting by everyone no one talks like that except in cartoons and the seemingly let s make it up as we go along direction i know that the participants in this mess must be very embarrassed by it and i feel certain that it did not help any careers as for this movie buff of 35 years it has now provided a ready answer for the worst film you ve ever seen question 
