911,given christopher nolan s string of successful films it s a no brainer for me to want to check out his filmography watch his debut feature which is shot in black and white back in england running less than 70 minutes long done with little budget but containing all the hallmarks that has made him a master filmmaker and storyteller though short the film is no less gripping with its meandering plot that will leave you guessing because the premise doesn t even scratch the surface of this tale which is pretty amazing considering the depth in the narrative s structure and characterization as told we follow a writer wannabe called bill jeremy theobald who starts a habitual obsession with following random people he fancies on the streets in a voyeuristic manner which at first could be conceived as research before he starts to make up his own rules and break them he meets up with charismatic cobb alex haw who turns out to be a robber with peculiar sensibilities and modus operandi and soon finds himself hooked with hanging out with him as they go about breaking and entering and speculating about their victim s livelihood as does the pursuit of a femme fatale blond lucy russell a mobster s moll who rejects his every advance told in a non linear fashion which comes with scenes that don t quite add up in the beginning this sets the film up for multiple viewings as you study just how nolan sustains that suspense and intrigue with you as the audience expecting and wanting more which gets duly delivered there are enough twists here which spins the film into a dizzying crescendo where loose ends begin to come together and the brilliance of the stellar story start to shine through it s also amazing how as a first feature shot on the cheap that something that clever and sophisticated can be conceived from his own experience in being burgled with nolan involved in every stage of production from writing to shooting producing and directing having worked on the project for a year since shoots can only happen on weekends i guess here s an example of a successful filmmaker s humble roots which should serve as inspiration and spur new filmmakers out there now i ll patiently wait for christopher nolan s inception due out later this year whose trailer is already such a tease 
803,so the wife and i just finished it despite several threats from both of us to turn it off for the most part boredom was the worst part of this movie there was just very little excitement the acting was atrocious to the point where we actually chuckled several times during some of the worse scenes the church lady for example the dead sister was using paranormal means to contact her living twin although rather then send useful information she focused on trying to scare the hell out of her instead which looked a lot like the ring rather then get the police involved which i m sure those earplugs she found would have dna all over them she instead devises a horrible plan to get the man who covered up the accidental death of her sister i call it a horrible plan because in the end she allows him to kill her too which the movie then fades to black bad dialog bad acting bad ending 
121,i had seen this movie long time back but found it amazing and to this day it has never stopped amazing me a wonderful movie that describes the account of a group of australian commandos who tried to sink some japanese ships at the singapore harbor during the height of ww2 these commandos are caught in plain clothes and they are considered to be spies by the japanese captors but something happens that hasn t been explored much in any hollywood ww2 movie that i have seen a close and friendly bonding develops between the captors and the captives they begin to respect each other while the captain of the captured australian soldiers become the best of friends with a senior japanese prison guard this is the most wonderful part of the whole movie and it really tugs your heart soon one day as the two friends are conversing the aussie captain learns that some other captives are going to be tried and executed for the sinking of the jap ships in the singapore harbor he mentions that it was his team and not some other s that had sunk the ships to his japanese friend and upon hearing this the japanese guard tells him to keep quiet as it might lead to his whole group getting executed but the captain remains adamant on confessing this to the japanese authorities finally the japanese authorities sentence them to death in the most respectful way that is according to their rules this is the highest honor accorded to the captured warriors in japan this is the most awesome part of the film where the aussie soldiers are awaiting their imminent death and the tense indecision of the friendly japanese guard who is still not ready to believe that why did his aussie friend confess being guilty i won t give away the ending here but it is more poignant than one can even imagine and can easily move one to tears all in all an excellent underrated movie that possibly didn t get the recognition that it deserved internationally get one copy today and be mesmerized 
654,another raquel welch classic this picture hit the theaters november 10 1969 starring raquel welch as michele james stacey as joe and luke askew as alan morris nikki is on her way to meet with her girl friends michele and jackie while on her way there she runs into her ex husband who wants a second chance nikki walk away from him goes to the table where she sees michele and jackie alan approaches her again and she starts to walk away when alan shoots her in the back nikki is taken to the hospital while michele and jackie go to the police station michele goes to the hospital where she meets up with jackie only to find that nikki died alan then goes after jackie who he hits with a car and then tries to run michele down michele jumps into her car and heads for los angeles when she gets there she calls lloyd her boss in las vegas to let him know that she was all right lloyd tells her to go to the club called the losers to see jeri about a job however there s one problem the bartender has a drug problem and alan knows it so alan and the bartender have a little talk back in los angeles michele not only gets a job as a dancer with jeri but also hooks up with jeri bouncer joe now some thoughts on this picture this picture was far better then raquel last and this one had nonstop action luke askew did a fine job of playing nikki ex husband he was your typical murder with the look that goes with it as for raquel welch performance the only word that comes to mine is fantastic she was awesome in this movie and her beauty stood out and shined like never before the outfit that she wore on stage to dance was breathtaking in fact all the outfits she wore in this movie were breathtaking of course it doesn t matter what raquel had on because she looks good in everything or nothing i give this movie 10 weasel stars for two reasons the first and by far is raquel welch who s the leading actress and deserves 10 stars the second reason is that this movie was wall to wall excitement from beginning to end 
386,oh man i know what your thinking with a title like that i can t go wrong uh yes you can i too loved the title but man i hated the stupid kid that played satan s little helper i hated the mom too and the sister daughter and her boyfriend i hated all those people man it was agony watching this sometimes the only reason this doesn t get 1 10 is becuz condsidering the low budget they did ok but oh man did i hate those actors so stupid i knew it was going to be bad i guess they saved a lot of money on just using halloween masks for the killer and the jesus costume at the end was really stupid too oh the agony do not watch 
214,sergio martino is a great director who has contributed a lot to italian genre cinema and as far as i am considered his gialli from the 1970s are the undisputed highlights in his impressive repertoire la coda dello scorpione aka the case of the scorpion s tale of 1971 is one of these impressive films martino has contributed to italian horror s most original sub genre and another proof that the man is a master of atmosphere style and suspense my personal favorite of the martino films i ve seen so far is still the insanely brilliant your vice is a locked room and only i have the key of 1972 followed by torso 1973 and the strange vice of mrs wardh 1971 all of which i personally like even more than this one that s purely a matter of personal taste however as la coda dello scorpione is an equally excellent film that is essential for every fan of italian horror cinema and suspense in general the film which delivers tantalizing suspense from the very beginning has a complex and gripping plot that begins with the mysterious demise of a millionaire who has died in a plane crash insurance investigator peter lynch george hilton is assigned to verify the circumstances the insurance company which is due to pay a large sum to the deceased man s wife soon after lynch begins to investigate a person is brutally killed which is just the beginning of a series of murders the case of the scorpion s tail excellently delivers all the elements a great giallo needs the film is stunningly suspenseful from the beginning the score by bruno nicolai is brilliant the plot is wonderfully convoluted and the killer s identity remains a mystery until the end regular giallo leading man george hilton once again delivers an excellent performance in the lead sexy anita strindberg is absolutely ravishing in the female lead the includes the great luigi pistilli one of the most brilliant regulars of italian genre cinema of the 60s and 70s and alberto de mendoza another great actor who should be familiar to any lover of italian cinema athens where most of the film takes place is actually a great setting for a giallo the atmosphere is constantly gripping and the photography great and bruno nicolai s ingenious score makes the suspense even more intense long story short la coda dello scorpione is another excellent giallo from sergio martino and an absolute must see for any lover of the sub genre stylish suspenseful and great in all regards 
314,oh man is this movie bad it flows horribly the story is about a race car driver who is in love with himself and then has to promote a chicken fast food chain and while doing this doesn t love himself he tries getting out of the contract and horrible painfully unfunny gags ensue jim nabors seems as if he s sleepwalking not acting you ll miss such burt sidekicks as dom deluise and jerry reed while watching this stinker loni anderson s hair is downright scary proving that tons of hairspray didn t go out in the sixties or maybe that was a wig speaking of burt s wig wasn t bad in this film his worst wig day was in smokey and the bandit 2 anyhow this movie is the worst reynolds car movie ever ever right up there with cannonball run 2 the original smokey and cannonball and hooper which thankfully had no sequel are great funny films this one isn t even ned beatty who is a great actor stinks you ll long for a jackie gleason type villain who is fun to hate and mind you this isn t one of those fun movies to bag on it s lousy pure and simple even the outtakes at the end were tiresome and boring and worst of all unfunny and least i forget stroker ace was one of the first heavy nails to seal burt s coffin before his somewhat revival years later in boogie nights another film that like deliverance years earlier shows that the man can act quite good when he has a decent platform to do so 
645,ok i just have 3 words cheesy cheesy and cheesy the only redeeming feature of this movie is dean cain other than that it s cheeseball supreme the movie does have some promise in the concept an underground lab creates a real live fire breathing dragon basically giving us more of jurassic park meets reign of fire there are some great possibilities but they just don t follow through the special effects are decent even though you know the dragon is cgi it doesn t horribly look like cgi i wouldn t lay the blame on dean cain although he is one of the producers i d lay more of the blame on phillip roth the director and writer it s his job to make this film and unfortunately he failed 
309,as much as i like big epic pictures i ll spare you the namedropping it s great to kick back with a few beers and a simple action flick sometimes films where the plot takes a backseat to the set pieces films where the dialogue isn t so cleverly written that it ties itself in endless knots of purple prose there are hundreds of films that fit the bill but in my opinion gone in sixty seconds is one of the better ones it s an update of the movie that shares its name it also shares that picture s ethos but not quite it s execution whatever was great about the original has been streamlined whatever was streamlined was also amped up thanks to a bigger budget often these kinds of endeavours are recipes for complete disaster see the pug ugly remake of the italian job for one that blew it but here thanks to a cast of mostly excellent actors sixty succeeds the plot and much of the dialogue isn t much to write imdb about often you ll have scenes where the same line of dialogue goes back and forth between the actors each of whom will voice it with different inflections a lot of people found this annoying i find it raises a smile each actor gets a chance to show off his or her definition of style here with cage jolie and duvall leading the pack of course and it should be noted that it s also amusing to see mrs pitt not given first billing here the chemistry between good ol saint nick the stalwart see date of review and angelina leads to a couple of nice moments the villain is not even a little scary i ve seen chris eccleston play tough guy roles before so i know he can handle them but i think he was deliberately directed to make his role inconsequential as not to distract from the action we know the heroes are going to succeed somehow we re just sitting in the car with them enjoying the ride i think a lot of these scenes were played with tongue so far in cheek that it went over the heads of a lot of people giving this a poor rating in fact i wouldn t have minded some fourth wall breaking winks at the camera it s just that kind of movie all this style and not so much substance something that often exhausts my patience if not executed just so would be worthless if the action wasn t there and for the most part it is wonderfully so i ve noticed that it seems to be a common trend to be using fast cut extreme close up shots to direct action these days i personally find this kind of thing exhausting i prefer movies like this where the stunts are impressive enough to not need artificial tension ramping by raping tight shots all the time i ve been told that cage actually did as many of the car stunts as he could get away with without losing his insurance in real life i mean his character clearly doesn t care and it shows the man can really move a vehicle and this is put to good use in the slow burning climatic finale where he drives a mustang into the ground in the most outlandish and fun way possible so yes this movie isn t an epic life affirming post 9 11 picture with obligatory social commentary effort the pacing is uneven some of the scenes could have been cut and not all the actors tow the line but car movies rarely come better than this so if you hate cars why are you even reading these comments i d take it over the numerous iterations of the flaccid and the tedious guess the franchise any day 7 10
928,i have to say i totally loved the movie it had it s funny moments some heartwarming parts just all around good me personally really liked the movie because it s something that finally i can relate to my childhood this movie in my opinion is geared more towards the young gay population it shows how a young gay boy would be treated while growing up all the taunting name calling and not knowing is something i like most other young feminine boys will always remember and now finally a movie that illustrates how hard it really is to grow up gay so i would definitely recommend seeing this movie probably shouldn t really watch it until a person is old and mature enough to understand it
783,i like breillat s movies but this one is the best i ve seen at balancing animal warmth with sexual intelligence anne parillaud is electric and the script is amazing especially considering it s supposed to take place on the set of another of breillat s movies you don t have to agree with her take on everything to get a lot out of this it made me think a lot about vulnerability and power try to imagine a male director with jeanne s openness not impossible but a little mind bending the unannounced sexual undercurrents that are always present when humans get together to make anything is held up to bright light here but not a cold light 
447,saxophonist ronnie bowers dick powell wins a studio contract and goes to hollywood he stays at hollywwod hotel of course at the same time big egotistical star mona marshall lola lane has a tantrum and refuses to attend the premiere of her new picture in a panic the studio hires lookalike virginia rosemary lane to impersonate her and have bowers take her to the premiere not telling him it s not marshall naturally they fall in love you can pretty much figure out the rest of the plot yourself the plot is old to put it nicely but powell and rosemary lane make a very likable pair and have beautiful singing voices the score is good highlighted by hooray for hollywood and director busby berkeley shows off his unique visuals in a really fun drive in musical sequence with edgar kennedy doing his patented slow burn also glenda farrell has a few funny bits as monas sister jonesie still the movie isn t that good the rest of the cast mugs ferociously and most of the humor is just not funny lola lane especially is just lousy trying to play mona for comedy also there is racism a stereotypical black maid is played for laughs and there s some truly appalling racist humor at one point that s probably what keeps this off tv most of the time i realize it was accepted at the time but it comes across as revolting today all in all a so so movie with some serious problems helped by a good cast and some great songs i give it a 7 
897,hare rama hare krishna was the biggest hit movie of 1971 filmed almost entirely in kathmandu the capital of nepal the movie depicts not only with the theme of a broken family but also a relationship between a brother and a sister as well as drugs and the hippie movement which made many people think that it involved the iskon the movement for krishna consciousness the movie begins with scenes of drugs and being informed that the woman dancing in front is the narrator s sister going back to the past the brother and sister are happily playing around the house only to hear their parents arguing this soon leads to a split in the family the brother goes with the mother and the sister with the father as years pass the brother goes in search of his sister and is informed that she no longer lives with the father and that she has moved to nepal here prashant the brother not only finds love but he also finds his sister janice but he finds out that she is not only in the wrong company of friends but is also on drugs as she wants to block all memory of her past with help of shanti his love the brother tries to get his sister away from all this but has to overcome many obstacles including people who stoop to all sorts of levels to stop him this is a multi cast movie and is led by the director and producer himself dev anand and also stars zeenat aman her first movie mumtaz rajendranath prem chopra jnr mehmood a k hangal and achala sachdev the music is superbly provided by the late r d burman whose last score was 1942 a love story during the filming dev anand asked panchamda r d burman to compose something special for this film days later panchamda came back with the composition of dum maro dum the song was an instant hit 
72,this movie starred a totally forgotten star from the 1930s jack pearl radio s baron munchausen as well as jimmy durante however 7 1 2 decades later it s being billed as a three stooges film because they are the only ones in the film who the average person would recognize today film fanatics will also recognize the wonderful edna may oliver as well as zazu pitts as for the stooges this is a film from there very early days before mgm had any idea what to do with the team at this point they were known as ted healy and his stooges as healy was the front man fortunately for the stooges they soon left this nasty and rather untalented man read up on him you ll see what i mean and the rest is history within a year they were making very successful shorts for columbia and executives at mgm were soon kicking themselves for losing the team this sort of thing was a common occurrence at mgm a great studio which had no idea what to do with comedy such as the films of buster keaton laurel and hardy abbott and costello and others in fact up until they left for columbia mgm put them in a wide variety of odd film roles including acting with clark gable and joan crawford in dancing lady and oddly in this film they didn t act as a team they just did various supporting roles such as larry playing the piano this particular film begins with pearl and durante lost in the african jungle when they are rescued and brought home all sense of structure to the film falls apart and the film becomes almost like a variety show punctuated by scenes with the leads here and there as for pearl i could really see why he never made a successful transition to films as he has the personality of a slug but slightly less welcome as for durante i never knew what the public saw in him as least as far as his films are concerned he was loud and loud he apparently took time off from helping mgm to ruin buster keaton s career to make this film together pearl and durante rely on lots of verbal humor and vaudeville style routines that tend to fall rather flat in this film the stooges they didn t yet have the right chemistry seeing healy doing the job that moe did in their later films is odd what they did in the film was pretty good but because all the segments were short they came on and off camera too quickly to allow them to really get into their routines stooges fans might be very frustrated at this though die hard fans may want to see this so that they can complete their life long goal of seeing everything stooge even the rotten joe derita and joe besser films oh and did they got bad after the deaths of shemp and curly overall the film is rather dull and disappointing however there are a couple interesting things to look for in the mess at about the 13 minute mark you will see a brief scene where a tour guide on a bus is singing look carefully as this is walter brennan in a role you d certainly never expect another unusual thing to look for in the film is the clean as a whistle song starting at about 22 minutes into the film this song and dance number is clearly an example of a so called pre code scene that never would have been allowed in films after 1934 when the production code was strengthened despite the word clean in the title it s a very titillating number with naked women showing lots of flesh enough to stimulate but not enough to really show anything it s quite shocking when seen today though such excesses were pretty common in the early 1930s finally at the 63 minute mark see jimmy durante set race relations back a few decades see the film you ll see that i mean 
46,there s only one thing i m going to say about cat in the hat as a kids movie and a good comedy movie it sucks i lost track of how many terrible jokes in the movie that not only sucked but weren t exactly kid appropriate oh and by the way the way the cat in the hat talked was annoying as for the plot i completely forgot who cares it sucked anyway i m not sure why mike myers joined but i think the writers were trying to make it sound like him in austin powers without the swinger talk and it overly succeeded but so what it was annoying don t see it it belongs in the bottom 100 the jokes are so unkiddy it s funny
440,this is my favorite renoir from the fifties it s the story of how henri danglard built and launched the moulin rouge nightclub we see the workmen blasting at the site to get construction underway and the training of the dancers finally the giddiness of opening night and the long sequence of cancan dancing financial problems and the ego displays of the performers are described gabin is in great form as the easy going danglard see him deal humorously with nini s violent boyfriend gianni esposito is moving as the wistful prince who is courting nini maria felix with that amazon s body is imposing as the egotistical lola danglard s first lover finally françoise arnoul as nini the washing girl who ends up dancing for danglard and becoming his girl is just stunning her loveliness and pert charm will win you over a bonus we get edith piaf patachou andré claveau and other stars in cameos playing the stars of a century ago who ruled over the moulin rouge 
